{
  "event_id": "evt_01J3V5Q0Y3R2Z3FJ2K7X9QH2B8",
  "event_type": "analytics.telemetry_window.closed",
  "event_version": 1,
  "occurred_at": "2026-01-22T01:00:05Z",
  "produced_at": "2026-01-22T01:00:06Z",
  "tenant_id": "tenant_01",
  "aggregate_id": "site:SH-001",
  "correlation_id": "corr_01J3V5Q0Y3R2Z3FJ2K7X9QH2B8",
  "causation_id": "evt_01J3V4ZZZ9GZ7Y8F8Q1K8R8X7N",
  "is_replay": false,
  "replay_id": "",
  "payload": {
    "window_start": "2026-01-22T00:00:00Z",
    "window_end": "2026-01-22T01:00:00Z",
    "source": "tsdb",
    "quality": "complete",
    "checksum": "sha256:9b1a2c3d4e5f"
  },
  "meta": {
    "schema": "analytics.telemetry_window.closed.v1"
  }
}